{
  "$schema": "https://json-schema.org/draft/2020-12/schema",
  "$id": "https://raw.githubusercontent.com/polynomial1027/songs-tuner/main/schema/singright-score.schema.json",
  "title": "SingRight Score",
  "type": "object",
  "additionalProperties": false,
  "required": ["format", "version", "metadata", "tempo", "timeSignature", "tuning", "notes"],
  "properties": {
    "$schema": { "type": "string" },
    "format": { "const": "singright-score" },
    "version": { "const": 1 },
    "metadata": {
      "type": "object",
      "additionalProperties": false,
      "required": ["id", "title"],
      "properties": {
        "id": { "type": "string", "pattern": "^[A-Za-z0-9._-]+$" },
        "title": { "type": "string", "minLength": 1 },
        "artist": { "type": "string" },
        "description": { "type": "string" }
      }
    },
    "tempo": {
      "type": "object",
      "additionalProperties": false,
      "required": ["bpm"],
      "properties": { "bpm": { "type": "number", "minimum": 20, "maximum": 300 } }
    },
    "timeSignature": {
      "type": "object",
      "additionalProperties": false,
      "required": ["beats", "beatUnit"],
      "properties": {
        "beats": { "type": "integer", "minimum": 1, "maximum": 16 },
        "beatUnit": { "enum": [1, 2, 4, 8, 16] }
      }
    },
    "tuning": {
      "type": "object",
      "additionalProperties": false,
      "required": ["referenceHz", "tonicMidi"],
      "properties": {
        "referenceHz": { "type": "number", "minimum": 400, "maximum": 480 },
        "tonicMidi": { "type": "integer", "minimum": 0, "maximum": 127 }
      }
    },
    "notation": {
      "type": "object",
      "additionalProperties": false,
      "required": ["clef", "keySignature"],
      "properties": {
        "clef": { "enum": ["treble", "bass"] },
        "keySignature": { "type": "integer", "minimum": -7, "maximum": 7 },
        "keyChanges": {
          "type": "array",
          "items": {
            "type": "object",
            "additionalProperties": false,
            "required": ["beat", "fifths"],
            "properties": {
              "beat": { "type": "number", "minimum": 0 },
              "fifths": { "type": "integer", "minimum": -7, "maximum": 7 }
            }
          }
        },
        "clefChanges": {
          "type": "array",
          "items": {
            "type": "object",
            "additionalProperties": false,
            "required": ["beat", "clef"],
            "properties": {
              "beat": { "type": "number", "minimum": 0 },
              "clef": { "enum": ["treble", "bass"] }
            }
          }
        },
        "repeats": {
          "type": "array",
          "items": {
            "type": "object",
            "additionalProperties": false,
            "required": ["beat", "type"],
            "properties": {
              "beat": { "type": "number", "minimum": 0 },
              "type": { "enum": ["start", "end"] }
            }
          }
        }
      }
    },
    "audioGuide": {
      "type": "object",
      "additionalProperties": false,
      "required": ["name", "trimStartSeconds", "offsetSeconds", "gain", "playbackRate"],
      "properties": {
        "name": { "type": "string", "minLength": 1 },
        "trimStartSeconds": { "type": "number", "minimum": 0 },
        "trimEndSeconds": { "type": "number", "minimum": 0 },
        "offsetSeconds": { "type": "number" },
        "gain": { "type": "number", "minimum": 0, "maximum": 1 },
        "playbackRate": { "type": "number", "minimum": 0.25, "maximum": 2 }
      }
    },
    "notes": {
      "type": "array",
      "items": {
        "type": "object",
        "additionalProperties": false,
        "required": ["id", "midi", "beat", "durationBeats"],
        "properties": {
          "id": { "type": "string", "minLength": 1 },
          "midi": {
            "oneOf": [
              { "type": "integer", "minimum": 0, "maximum": 127 },
              { "type": "null" }
            ]
          },
          "beat": { "type": "number", "minimum": 0 },
          "durationBeats": { "type": "number", "exclusiveMinimum": 0 },
          "numeral": { "type": "string" },
          "lyric": { "type": "string" },
          "spelling": { "type": "string", "pattern": "^[A-G][♯♭#b]?-?[0-9]+$" },
          "explicitAccidental": { "enum": ["flat", "natural", "sharp"] },
          "tieToNext": { "type": "boolean" }
        }
      }
    }
  }
}
